招聘岗位,工作职责,工作要求
PCG09-信息流合作策划产品经理,基于信息流的流量特点与能力，负责与合作伙伴、多业务团队的合作方案策划与落地；\n管理合作需求、用户需求和运营需求的优先级和平衡；对合作需求的数据效果进行跟踪评估，持续迭代及运营；\n洞察行业趋势，了解玩法，善于发现新的合作机会,本科或以上学历，互联网产品经验至少1年；\n擅长合作沟通，具备良好的项目管理能力；\n逻辑思维清晰，产品的策划和运营sense良好，熟悉数据分析方法，具有决策能力
CSIG17-地图数据评测,1.针对客户关注的热点区域或者头部城市数据进行规范性的评测；\n2.结合现实客观存在，针对数据，制定不限于道路数据、兴趣点、公交等数据评测目标和方法；\n3.根据评测结果进行综合数据分析并输出专业的评测报告；\n4.对现有评测体系进行优化和升级，使之始终保持与产品端上功能升级的数据体验同步；\n5.跟进地图未来发展趋势，研发新型评测体系方案。,1.大学本科以上学历\n2.三年以上互联网地图产品、数据生产或评测工作。\n3. 对LBS领域有浓厚兴趣，对用户数据敏感，逻辑思维能力强.\n4.有较强的数据分析能力。\n5.有较强的项目管理能力。\n6.有一定抗压能力，自驱力、有较强责任心和团队协作精神。\n7.有驾照，会驾驶
30628-腾讯广告大数据后台开发高级工程师（研发中心-北京）,负责广告在线预估服务的架构设计和开发，支持高并发，高可用，低延迟；\n负责广告平台用户画像线上系统的开发和维护；\n负责高可用的任务调度系统开发，支持各种离线任务的分发和调度；,重点大学本科以上学历，计算机相关专业；\n两年以上相关工作经验，精通算法与数据结构，精通c++编程语言；\n有扎实的编程功底和编码习惯，以及良好的分析解决问题能力;\n熟悉机器学习框架和分布式系统，熟悉tensorflow等机器学习框架者优先;\n积极主动，有责任心，勇于接受挑战。
21087-游戏版本管理（深圳）,负责手游产品技术接入工作、版本管理工作、对各阶段版本质量及排期负责；\n负责推进研发商按时按质完成版本内容、平台接入、tlog、运营功能等开发工作；\n跟进版本测试验收、版本部署、版本发布等版本流程各环节工作；\n负责游戏环境、游戏生态维护及舆情监控相关工作。\n,本科及以上学历，有较强的逻辑思维能力； \n有3年以上网络游戏工作经验，1年以上版本模块工作经验，熟悉游戏开发或运营流程，能独立规划和协调平台各个模块成员的开发工作； \n积极主动，沟通能力强，能够在复杂的环境中推进项目前进，具备优秀的自我驱动力、团队协作能力及跨部门协作推动力； \n具备一定的英文听、说、读、写能力。\n
TEG03-终端开发工程师,职位描述：\n\n负责项目所需要的移动端（SDK、App、开发者工具）的开发及维护；\n\n负责重大或疑难问题的技术攻关；\n\n对新技术预研，并能主动思考与产品的结合方向，推动技术工具的演进，及研发团队文化建设。\n\n\n\n,工作要求：\n\n熟练掌握Java/Kotlin，掌握常用Native层Framework的实现原理；\n\n具备较好的沟通能力，富有团队精神和敬业精神，具有较强的自学能力；\n\n具有iOS平台开发经验者优先。
TEG03-数据挖掘工程师（深圳）,通过海量数据对用户广告的行为进行深入分析与洞察，提炼和发现业务规律，指导推荐模型特征构建，定位产品相关的数据问题及分析优化；\r\n结合广告投放场景和用户画像进行badcase分析、归纳统计指标建设，协助模型快速定位问题。,计算机、数学、统计、数据挖掘等相关专业本科及以上学历；\r\n1年以上互联网、IT相关工作背景及数据分析挖掘相关工作经验；\r\n熟悉统计原理及检验方法、熟悉数据分析方法；\r\n熟悉分类、回归、聚类、降维等机器学习算法及应用场景；\r\n熟悉Linux、Shell、R/Python，Hadoop/Spark等，能独立完成相关的数据分析及分析报告相关工作；\r\n有互联网推荐领域相关工作经验更优。
TEG01-自然语言处理工程师（深圳）,参与智能客服平台建设，提供基础的自然语言处理解决方案；\n应用深度学习模型对文本信息进行语义处理，负责深度模型的训练和调优；\n结合业务实际，探索智能客服领域领先的技术解决方案。\n,模式识别与自然语言处理相关方向计算机专业，硕士及以上学历；\n在智能客服、聊天机器人等方向有三年以上实际项目经验；\n在如下领域有丰富经验：文本分类、多轮对话、关系抽取、实体识别等；\n有较强的算法分析和实现能力，熟练掌握c/c++/java/python，有linux开发经验；\n熟悉Tensorflow或Pytorch，深入理解LSTM、Attention、Word2Vec、ELMO、Bert等基本模型；\n优秀的分析和解决问题能力，勇于挑战，对数据敏感，有强烈的好奇心，良好的团队精神。\n
TEG01-C++后台开发工程师（深圳）,责客服后台服务研发工作； \r\n参与现网问题定位和解决工作；\r\n跟进后台服务研发运维工作。,计算机或相关专业本科及以上学历；\r\n3年以上相关工作经验；\r\n精通C/C++语言，熟悉设计模式、开发规范；\r\n熟悉TCP/IP协议、进程间通讯编程，熟悉Linux下常用架构设计方法；\r\n熟悉Linux操作系统原理及常用工具，熟练使用shell、python脚本；\r\n熟悉Mysql等关系数据库，熟悉Redis等NoSQL存储；\r\n正直，责任心强，具有良好沟通和团队协作能力，主动，好学；\r\n具备良好的分析解决问题能力。
TEG01-前端开发工程师（小程序）,负责部门网站、运营平台Web前端、小程序等设计、开发和实现；\n负责代码、工程及技术体系的建立及完善，帮助团队成员进步及成长,本科及以上学历，计算机相关专业优先，3年以上前端工作经验；\n精通javascript，有面向对象，模块化开发的设计思想；\n熟悉常见的JS开发框架，至少熟练使用Vue或React中一种框架，有移动端开发经验、服务器端开发经验者优先；\n熟悉HTML5、CSS3，有SASS 或 LESS 和 移动端页面重构开发经验优先；\n思路清晰，具备良好的沟通能力和团队协作精神。\n
18428-银行业务测试工程师（深圳）,负责金融科技和移动支付方面的功能、性能、安全等测试工作，挑战如微信红包等海量业务系统。负责微信支付，QQ钱包等平台级支付产品的系统测试工作，参与项目研发全流程。\n\n1. 参与软件项目的需求分析，关注项目需求的合理性，可测性； \n2. 参与重大产品需求和架构设计评审，保证产品设计与架构的合理性； \n3. 设计合理的测试用例，并能参与到具体的测试执行工作中，跟进缺陷的fix、质量复核，能引入比较好的思想和方法，保证产品的质量； \n4. 参与自动化用例的编写，设计\u0026参与产品的性能、安全测试，解决测试过程中的复杂技术问题； \n5. 根据产品研发的实际情况，改进or设计软件质量保证体系，并推动落地实施； \n6. 通过测试相关流程、策略、方法和工具等创新，提升测试的质量和效率； ,1. 工科、计算机或其他相关专业本科以上学历； \n2. 具有3-5年以上软件开发和测试经验，能快速熟悉理解业务，有负责带领进行大型项目测试经验； \n3. 掌握or熟悉c++、java编程，熟悉mysql等db，有互联网行业从业经验； \n4. 有自动化测试经验，能独立设计用例并编写代码实现自动化测试； \n5. 具备撰写自动化测试工具以及搭建自动化测试平台的实战经验者优先； \n6. 有产品性能、安全等测试经验，掌握基本的性能测试及产品安全知识； \n7. 熟练使用linux操作系统，具有基本python或shell等脚本编写能力；
18432-微黄金产品运营经理,1. 负责微黄金业务的日常运营及节日运营，能够把握关键点，通过运营策略达到业务目标；\n2. 负责微黄金业务的用户运营，用户分层运营，通过用户教育、用户关怀及营销活动等策略提升用户留存及转化；\n3. 跟进内外渠道合作落地及效果反馈，高效沟通，推进合作，确保结果；\n4. 对数据敏感，善于运用数据进行分析和总结经验，调整运营策略，服务业务目标,1. 全日制本科及以上学历；\n2. 3年互联网公司产品运营经验，有互联网金融产品运营经验者优先；\n3. 有责任感，执行力强，有担当，能落地，对结果负责；\n4. 善于思考和学习，能够保持行业敏感性。
18432-微黄金产品经理,1、负责微黄金的产品策划和策略制定，包括产品版本计划、产品功能设计、产品发布跟进、产品优化升级等工作；\r\n2、对产品的用户体验负责，能够深入用户，理解用户使用行为、使用习惯，洞察用户行为背后的需求；\r\n3、跟进产品执行的各个环节，保证项目的高效高质量执行，对负责的产品模块进行效果跟踪、数据分析、用户分析，并及时反馈到产品规划中。,1、本科以上学历，三年以上移动产品经验；\n2、对用户体验敏感，热爱接触用户，通过用户运营建立与产品之间的沟通桥梁，帮助提升产品体验和忠实用户维护；数据分析能力和逻辑思维能力强，可以透过数据剖析产品数据背后的原因，并落地到优化实践中；对工作有负责到底的态度，做事细心、踏实，执行力强；善于沟通表达，做事积极主动，懂得团队合作。
18435-反洗钱合规经理（香港）,1.整体负责可疑交易的监控及报告，不断完善相关系统及内部流程、制度；\n2.汇总反洗钱合规需求及追踪落地；\n3.协助合规风险识别、评估，编写各类合规报告；\n4.协助监管政策研究分析，制度反洗钱内部政策并推进落地，开展反洗钱自查；\n5.协助实施业务及运营管理过程中的合规支持与合规审核；\n6.领导交办的其他工作。\n,1.全日制大学本科及以上学历，法律、审计、财务、金融等相关专业；\n2.五年及以上金融类行业反洗钱类工作经验；\n3.熟悉香港与马来西亚反洗钱法规，与香港与马来西亚金融业反洗钱实践，有良好的合规及风险控制意识和较强的分析问题能力；\n4.具有良好的沟通、协调能力，较好的学习能力，诚实并有责任心；\n5.有较好写作能力。
18435-项目经理,1、负责财付通金融支付业务的风控管理项目跟进工作，包括主要里程碑达成，任务执行进展，日常团队沟通工作等； \n2、负责反洗钱及风控各类需求的项目计划的制定、跟踪和维护，确保项目按照计划交付； \n3、负责落地执行各业务流程，做好项目管理类流程的团队适配，组织项目各项评审会议及项目例会； \n4、整理各类项目报告，确保项目有序推进，信息透明。\n,1、本科及以上学历，5年以上项目管理经验；\n2、从事过安全类/支付类/金融类业务经验者优先；\n3、有较强的团队合作，沟通能力和协作意识，抗压能力强；较强的逻辑分析能力，有独立负责项目管理的经验；\n4、具备一定的数据分析基础，具有良好沟通能力；\n5、有相关项目管理资格认证者优先。\n
18425-国际支付业务基础开发高级工程师 (深圳),"负责微信支付香港钱包相关系统的开发;\n参与模块设计开发,业务逻辑开发,银行接入等工作；\n参与相关子系统及业务流程优化重构,研发过程优化工作。","计算机、通信相关专业本科以上学历;\n2年以上linux服务器端软件开发经验;\n编程基本功扎实,精通C/C++,熟悉面向对象技术,设计模式;\n精通TCP/IP协议相关知识及网络编程;\n精通Unix/Linux环境和系统编程，熟悉服务器编程模型；\n精通mysql数据库及相关编程;\n善于沟通及主动思考总结,倡导创新与持续优化,思路周密,代码严谨,对待技术有强烈兴趣;\n有良好的团队合作及抗压能力,有强烈的主人翁意识推进事务进展;\n具备一定架构能力,有大容量、高性能、分布式系统的设计开发经验优先。"
18425-支付项目经理,1、 负责项目资源的协调与组织，确保项目团队各干系人协同工作； \r\n2、 负责项目计划的制定、跟踪和维护，确保项目按计划完成； \r\n3、 负责组织项目各项评审会议及项目例会； \r\n4、 制定并推广项目流程规范，确保项目有序推进。,1、 本科以上学历，3年以上项目管理经验；\n2、 有较强的团队合作，沟通能力和协作意识，抗压能力强；较强的逻辑分析能力，有独立负责项目管理的经验；\n3、 具备一定的数据分析基础，具有良好沟通能力；\n4、 具备英语交流能力者优先。
PCG04-短视频AI评测工程师（深圳总部）,负责短视频业务的评测及工具平台建设工作；\n短视频质量评价体系建设、图像质量评价体系建设，包括但不限于视频内容理解、视频内容质量检测、推荐算法、目标检测追踪、行为分析、图像分割、自动PS等算法质量评测方案设计、工程技术落地工作；\n科学建设视频评价体系，并基于反馈甄别badcase和算法的缺陷，进而对AI产品提出改进意见，优化产品质量,计算机或者图像处理、计算机视觉、模式识别、机器学习等相关专业。三年以上计算机视觉领域相关工作经验，熟悉计算机视觉领域的主流模型和算法，关注领域内的最新进展；\n有良好的计算机专业知识基础，对数据结构、操作系统、算法等专业知识掌握良好，熟练掌握C/C++，Java，Python等至少一门语言，有一定的软件开发项目经验；\n具有扎实的算法基本功、突出的数据、算法分析和归纳能力，对新技术充满好奇心，爱挑战高难度，善于提出idea并能快速动手验证；\n有视频图像、搜索推荐实际应用经验者优先考虑。较好研究成果（学术论文等）者或者在相应竞赛中取得过较好成绩者优先考虑。
PCG04-高级测试开发工程师（深圳）,负责支付、游戏等业务后台、移动端的架构、代码层面的专项分析及优化，包括但不限于性能自动化、接口自动化、可测性分析等质量保障工作；\n结合业务推进测试体系的建设，并配合进行相关工具平台设计及开发工作，加速产品研发效率；\n持续探索引用行业相关测试技术和理念，帮助团队提升质量和效率。,本科及以上学历，计算机或软件相关专业，具备扎实的计算机和软件技术基础；\n至少3年以上的软件开发或者测试开发工作经验；\n熟悉C/C++/Java等至少一种主流编程语言，熟悉至少一门脚本开发语言（如shell、perl、python）；\n具备良好的学习能力、质量保障体系思路、复杂问题定位和分析能力；\n具备创新性思维、较强的抗压能力和技术钻研能力；\n具备后台开发或移动终端开发经验者优先，有优秀工程素养，对持续交付有深入理解和实践经验优先。
PCG04-后端开发工程师（深圳）,负责PCG短视频和媒体分发业务相关工具链平台建设，通过和相关业务系统的对接，挖掘研发流程中的痛点，提炼产品需求，建设工具平台，持续提升研发效率。,本科以上学历，计算机相关专业，3年以上Unix/Linux操作系统下java/go/c++后台开发工作经验；\n有高并发和大规模数据存储（hbase、mangodb、es、redis等）处理经验；\n理解微服务架构，有较好的系统分析架构能力；\n熟悉linux，具备较强的问题定位和分析能力，具备性能优化经验更佳；\n自我驱动，具有较强的抗压和沟通协作能力；\n有devops经验者优先。
PCG04-测试开发工程师（北京）,负责移动端或后台应用的专项测试工作，包括参与需求分析，帮助完善需求与开发设计实现，合理设计测试计划，实施测试活动，跟进缺陷，协助研发分析定位问题。\n负责移动端或后台产品的自动化测试，包括功能接口、性能、稳定性、兼容性等。保障产品全流程的质量和高效交付。\n挖掘研发过程中提升质量和效率的工具需求，完成各类测试工具的架构设计、编码实现和在业务的落地，提升整体研发过程的工作效能。,本科及以上学历，计算机或相关专业；\n2年及以上测试/开发工作经验，具备良好的问题分析能力。\n掌握至少一种编程语言，如C/C++、Java、Python等语言，有相关的项目实战经验。\n具备良好的技术钻研能力、沟通表达能力和独立问题解决能力。\n符合以下条件优先：有移动端或后台自动化测试框架开发、测试工具/平台开发经验优先；有白盒测试开展经验，对研发架构有较深入理解，具备研发架构优化和开发经验优先。
PCG04-短视频高级后台开发工程师（深圳）,负责PCG短视频业务的架构设计、开发和测试；\n参与新系统的需求分析、核心框架及组件的开发以及测试工作；\n优化和改进现有产品以提升用户体验；\n持续从技术上提升服务稳定性、安全性、可用性等技术能力。,本科以上学历，计算机相关专业，3年以上Unix/Linux操作系统下java/go/c++后台开发工作经验；\n熟练掌握java/go/c++中两门语言；\n有高并发和大规模数据存储（hbase、mangodb、es等）处理经验；\n理解微服务架构体系，理解框架设计和系统集成的原则；\n能独立承担任务，具备优秀的分析和解决问题的能力；\n有团队精神，具有良好的沟通能力。\n符合以下条件优先：拥抱DevOps；有短视频产品开发和测试经验；具备良好的性能意识，有性能分析和优化经验
PCG04-web前端高级开发工程师,负责中台工具建设相关平台开发、维护和优化工作，能做出合理的技术解决方案；\n优化和改进现有产品以提升用户体验；,"1、计算机或相关专业、本科及以上学历；三年以上工作经验；基础扎实，熟悉常用的数据结构和算法；掌握操作系统、计算机网络、软件工程等专业知识 \n2、熟悉Web应用系统开发，对HTTP协议及web服务器等有所理解；\n3、对Web标准有良好认识，精通HTML5/JavaScript/CSS3等Web开发技术，熟练掌握至少一款当下主流的前端框架，如Vue、React、angular等；\n4、熟悉一门以上WebServer后台开发语言（如java,nodejs,Python），熟悉数据库操作，具有Linux平台下开发经验者优先；\n5、良好的沟通表达能力和团队合作意识，责任感强，热爱学习，热爱开发工作，拥抱开源技术，能高效配合团队成员，共同完成项目。"
PCG04-测试开发工程师（深圳）,负责机器人（包括Android、iOS端、硬件机器人端）的业务测试工作，从定制计划和方案等到具体实施，保证项目整体质量和进度； \n负责从架构、代码层面的专项分析、评测和优化，包括但不限于性能自动化、接口自动化、可测性分析解决、语音语义评测等质量保障工作；\n结合业务推进自动化体系的建设，加速产品研发效率。,本科及以上学历，计算机或相关专业，具备扎实的计算机和软件技术基础；\n3年及以上测试工作经验，熟练掌握至少一种编程语言，包括但不限于C/C++、Java、Python、Shell等；\n熟悉Android/iOS移动操作系统，具备自动测试工具或性能测试、协议测试，服务器后台测试等经验；\n有相关智能硬件产品开发或者测试经验者优先，例如智能音箱等项目经验；\n热爱软件测试工作，可以胜任重复性工作，工作细致认真，有耐心； \n具备良好的团队合作意识，较强的沟通能力和表达能力。
21882-腾讯医疗产品组长（北京）,负责医疗产品的整体产品规划和策略制定，以及产品团队日常管理；\n带领团队深度研究用户（医生或患者），从而在产品设计、内容选题、表达形式上及时跟进需求，并不断探索创新；\n负责与内容、技术、运营、市场、BD、等团队沟通，确保各team对产品的充分理解，并推动团队协作支持；\n负责带领产品团队达成产品目标；\n了解互联网医疗行业动向，及时、准确地研究、分析竞争对手动态，并提出相应的对策。,本科及以上学历，5年以上互联网平台经验，有医学教育背景或医疗从业背景最佳；\n有优秀的产品聚焦和产品策划意识，熟悉腾讯内部各大产品线；\n对于用户体验有深刻的理解，能够很好的规划和设计产品功能、使用流程与交互体验；\n对医疗行业有情怀与热情。
15851-游戏音频师（深圳）,负责腾讯光子工作室群旗下的：\r\n游戏声音设计；\r\n声音资源的创作和编辑；\r\n音频在游戏中的播放；\r\n给视频配声音。,"-Sound Designers who would like to work in Shenzhen, China;\n愿意在中国深圳工作；\n-Roughly 3-5 years’ industry experience in game audio;\n至少3-5年的游戏音频经验；\n-Professional in game audio sound (sound design, foley, field recording, mixing);\n专攻音频方面（音效设计、拟音、实地录音、混音等）；\n-Familiarity with Wwise;\n熟悉Wwise等；\n-Proficient command of sound design and mixing with a variety of techniques;\n熟练运用多种技术技巧进行音效设计及混音；\n-Experience with the entire game audio design process (sound effect, music, voice over, and middleware implementation);\n参与过游戏音频设计的完整流程（音效、音乐、配音、音频合入等）；\n-Excellent self-motivation and team spirit.\n具备出色的自主学习能力及团队合作精神。"
WXG10-212 企业微信应用市场产品策划经理（广州）,负责企业微信第三应用接入的相关产品工作。 负责第三方应用市场的相关产品策划，包括功能模块的策略制定、功能设计及推动上线等； 负责第三方应用接入的整体规划，细化不同类型应用的接入计划和优先级； 与合作伙伴负责人对接，审视应用的价值和重要性，安排和推动应用快速接入； 理解第三方应用的使用场景和定位，以用户价值和体验思维帮助合作伙伴梳理产品定位、功能框架、交互和体验；, 本科及以上学历，2年以上互联网产品策划工作经验，有企业产品背景更佳； 对用户体验有较深入了解者优先。对移动互联网有很好的理解和兴趣； 很强的逻辑能力、系统思考能力并具优秀产品意识；
WXG11-113 微信读书数据平台开发（广州）,微信读书数据平台开发，负责微信读书数据平台的架构和开发，为统计分析提供基础服务；,热爱互联网，熟悉各种互联网产品，勤奋好学； 计算机、通信、数学相关专业毕业，大学本科以上学历，计算机基础扎实，3年以上工作经验； \n精通 C++/Java/Go 等高级语言编程，具备扎实的分布式系统开发功底；\n熟悉 Hive、MapReduce、Storm、Spark、HBase 等 Hadoop 生态系统；\n熟悉 MySQL、Oracle 等关系型数据库以及 ElesticSearch、Kylin 等 OLAP 分析引擎，具有实际开发经验；\n具有强烈的责任心以及团队合作精神，具有较强沟通能力。\n
WXG10-113 企业微信技术合作中心后台开发工程师（广州）,负责企业微信开放相关的后台研发工作,（1）本科及以上学历；\n（2）1年以上Linux编程经验，对互联网有一定的认识，对工作有激情；\n（3）逻辑思维清晰，数据结构、算法等基础扎实；\n（4）精通C/C++，代码质量高，掌握linux多进程、多线程编程；\n（5）在网络、存储处理等方面有专长；\n（6）对信息安全有一定了解
CSIG07-运营开发工程师（深圳）,负责部门安全类业务支撑系统的开发和维护；\n负责部门创新产品的功能运营开发。,精通PHP，2年以上PHP开发经验，至少熟练掌握使用一种PHP框架；\n熟悉Javascript、CSS、AJAX、JSON、JQuery、HTML5等Web页面技术；\n熟悉linux或者windows环境下web服务架构、mysql及性能调优；\n了解apache/nginx服务器，有C/C++，python编程经验者优先；\n有良好的团队合作能力，善于沟通，具备良好的问题定位分析能力。
