招聘岗位,工作职责,工作要求
CSIG07-WEB前端开发（企业安全方向）,负责部门企业安全的官网开发和维护工作；\n负责部门企业安全类业务项目的前端开发与维护；\n负责部门企业安全项目小程序的前端开发和维护。,"三年以上WEB前端开发经验，精通HTML5/JavaScript/CSS3等Web开发技术； \n熟悉JQuery，bootstrap，vue，react等框架，至少熟练掌握一种以上；\n对Web标准有良好认识，能够高保真还原设计稿，代码风格严谨工整，能够兼容各种浏览器； \n对Web前台的性能优化以及Web常见漏洞有一定的理解和相关实践； \n熟悉mysql，有小程序和后端开发经验者优先(如nodejs或者php);\n有良好的对外沟通和团队协作能力,具备良好的分析解决问题能力。"
CSIG07-企业安全项目经理（深圳）,负责企业安全项目管理工作。负责企业安全项目的全流程交付管理，确保项目顺利按时交付；\n负责企业安全项目计划的制定、跟踪和维护，确保项目按计划完成；\n负责企业安全项目客户关系维护，产品交付计划、沟通、实施、服务等全流程管理；\n负责企业安全项目相关干系人管理维护；\n负责企业安全项目相关的流程规范建设，确保项目有序进行,1、计算机、通信或相关专业本科以上学历；\n2、至少5年以上项目管理经验，2年以上面向企业的解决方案的交付项目管理经验；\n3、至少成功主导完成过一个企业解决方案的研发全部流程和交付全部环节\n4、有较强的文档撰写能力，汇报PPT编写能力，逻辑性强；\n5、具有良好的执行力和责任心，能推动项目团队朝目标前进；\n6、具有丰富的与人沟通、交流和组织能力，出色的团队合作精神；\n7、有安全产品研发和管理经验优先；
PCG15-数据产品经理,1、负责互动视频部各业务的数据治理体系搭建，推进数据体系的优化和完善； \n2、数据产品和工具的设计和落地； \n3、通过数据发现业务和产品中的问题，提出改进策略，并推进落地实施，观测效果反馈；\n4、 规划业务分析点，并负责例行化分析报告和专项分析报告的生产； 能快速了解行业，深入分析行业生态。,1、本科及以上学历，计算机、应用数学、统计等专业硕士优先； \n2、扎实的统计基础，突出的逻辑分析和归纳能力，优秀的业务理解力和洞察力，善于沟通和表达； \n3、掌握从数据埋点到数据可视化各环节的关键技能； 熟练使用sql/R/SPSS等分析工具， 有直播相关行业从业经历者优先； \n4、熟悉Hadoop、Spark、数据集成、数据治理、商业智能分析BI等技术原理，具有实践经验有二年以上互联网行业数据处理、分析经验优先。
21309-深圳市腾讯教育科技有限公司--ABCmouse渠道营销经理,1、制作营销工具和销售工具，赋能代理商，确保产品信息清楚和高效的被沟通。\n2、对接和管理分销商，了解分销商的运行机制，为分销商推广工作提供指导和建议。\n3、 收集幼儿园和机构的需求信息和产品反馈，为产品与市场方案优化提供方向。\n4、针对幼儿园和机构的市场活动设计和执行，促进用户和老师使用我们的产品并成为付费用户。,1、能够独立输出线下渠道推广需要的营销工具包，赋能商务在1对1 拜访和会议销售中清楚和高效的进行沟通。\n2、具有分销商管理经验，能够及时掌握分销商的运行机制和一线情况，指导分销商更好的开展业务。\n3、具有线下渠道的活动和推广经验。\n4、具有教育行业背景优先。\n5、思路清楚，表达流利。\n6、具有良好的自驱性。\n7、工作经验3年以上。\n注：此岗位为腾讯旗下全资子公司编制岗位
21309-深圳市腾讯教育科技有限公司--广告投放优化师,1、负责K12在线教育产品线上广告投放，分析与研究推广数据和效果；\n2.、主要负责广点通、微信朋友圈、今日头条广告的投放；\n3、对所负责的投放的广告素材和优化；\n4、监控和研究竞争对手推广策略，不断优化ROI。\n5、有较强的的沟通、协调、决策能力，具有团队合作精神。,1、本科及以上，有广点通，微信朋友圈、今日头条等广告投放的经验，有过实际操作案例，月消耗百万优先；\n2、有线上活动运营经验，熟悉互联网传播方式；\n3、对移动K12在线教育兴趣浓厚，会PS、excel、PPT、视频剪辑等基本办公软件；\n4、学习与沟通能力强，抗压能力强，执行力强，在乎细节;\n5、有创造力，有好的审美和开放视野\n注：此岗位为腾讯旗下全资子公司编制岗位
PCG14-流量生态后台开发工程师（深圳）,岗位职责:负责应用宝流量生态的高性能后台服务开发;\n负责应用宝后台流量生态推荐工程侧服务开发，商店数据源，模拟下载器，消息通道服务工程建设;\n负责通用业务组件的设计、开发和维护\n,"一、基本技能要求\n 1、熟练掌握C、C++语法，深入理解其特性。（熟练使用python、go等语言并开发过相应项目优先）\n 2、熟悉常用数据结构(BTree、堆、栈等)\u0026算法(单模式匹配、多模式匹配等查找算法)\n 3、熟练掌握SQL语言，能够对数据库、SQL进行基本的调优。\n 4、熟练掌握HTTP/HTTPS、理解TCP/IP等协议。\n 5、良好的调试功底，能熟练使用GDB工具，能独立分析coredump并找出原因。\n\n 二、进阶技能要求\n 1、熟悉Redis、MemCache、Nginx、Zookeeper等开源组件的工作原理\n 2、能合理设计Cache来提升服务性能\n 3、海量服务系统架构设计和调优能力\n 4、线上问题的分析解决能力\n 5、单机性能分析和优化能力（有valgrind、perf、GDB 工具使用经验者；或类似优化经验者佳）\n\n 三、通用能力\n 1、良好的沟通能力,前后逻辑清晰\n 2、具有一定的产品理解能力\n 3、良好的团队合作意识，能打好配合\n 4、有从事过商业化或者广告相关工作经验者优先\n"
27092-应用宝渠道管理经理（深圳）,应用宝商业化广告代理商体系运营管理；\n基于业务需求，制定代理商驱动策略，以项目管理方式进行监控、执行和考核管理。\n联动行业商务及运营团队，驱动代理商进行行业重点客户服务及重点行业拓展渗透。\n根据业务发展不断完善代理商体系，梳理和建立代理商内外业务协同流程。\n,本科及以上学历，3年以上工作经验；\n具备渠道管理、销售管理经验优先；\n善于数据分析，基于数据提炼总结，对效果广告及商业化有一定见解；\n积极主动，能承受一定工作压力，沟通能力与执行力强。\n
PCG14-腾讯手游助手后台开发（深圳）,负责手游助手平台的高性能后台服务开发，需要参与后台架构设计和性能稳定优化\n负责手游助手后台业务组件的开发和维护,本科及以上学历，计算机相关专业，3年及以上相关工作经验；\n精通Node.js后端Server研发，具有丰富的服务高并发、性能分析调优、后端服务架构经验；\n熟悉服务端开发(cgi、asp、net、php、jsp)，并具有3年及以上linux等相关平台下开发经验；\n对数据库（mysql / mongodb / sqlite3 / sqlserver）熟练掌握，有相关性能调优者优先；\n有web前端开发经验者优先；\n具备良好的责任心与工作激情，团队合作能力强。
19332-产品运营经理（客户运营）（上海）,负责企业级SaaS产品的运营及重点客户管理工作，包括产品灰度、产品发布、产品改进需求引入、用户关系管理、运营数据分析等，通过运营达成客户活跃度、健康度与满意度提升的业务目标； \n同时肩负运营创新与运营手段的拓展，跨部门的工作协同与问题解决，将产品的能力与为客户业务带来价值的能力对应起来，在熟捻客户的业务场景的基础上，保证高优先级需求的顺利交付。,本科及以上学历； \n5年以上企业级产品的策划、开发、运营及项目管理的经验； \n具备良好的组织能力及沟通执行能力； \n熟悉企业的市场、营销、服务等部门的业务场景，有较强的数据分析、需求分析、产品PRD的撰写能力； \n有强烈的责任感及上进心，抗压能力强； \n有较强的学习能力和自我驱动的意识；\n有技术背景及管理岗位经验者优先考虑。
30361-语义分割算法研究员,1. 负责视频，图像精细化人景分离算法的技术研究和项目落地；,1. 计算机/电子信息/数学相关专业，硕士及以上学历\n2. 精通图像处理、语义分割理论和算法，尤其对视频中的人像分割场景，有很好的研究积累和创新能力；\n3. 熟悉OpenCV，精通Caffe/ MXNet /Pytorch/TensorFlow等计算机视觉框架的其中一种开源深度学习框架；\n4. 极佳的工程实现能力，有过知名产品落地经验；\n5. 研究能力强，如在CVPR/ICCV/ECCV/NIPS/ICML/SIGGRAPH等会议上发表过论文优先考虑
18428-财付通清算业务后台开发工程师（深圳）,负责财付通清算业务的后台研发;\n参与付款系统的设计开发，维护各大银行的渠道，优化微信个人提现、理财通赎回等业务的到账时效性；\n优化付款系统的架构，提升性能和可靠性;,"计算机、通信相关专业本科以上学历; 2年以上相关工作经验；\r\n 1. 精通C/C++，精通linux下后台开发，熟练使用常用的shell命令\r\n 2. 精通mysql数据库及相关编程;\r\n 3. 熟悉面向对象技术,设计模式;\r\n 4. 具备一定架构能力，具备网络编程经验，熟悉多线程开发模式;\r\n 5. 有银行、电信计费批处理软件开发经验优先;有大容量、高性能系统的设计开发经验优先;"
22989-Web前端开发高级工程师,负责腾讯云音视频产品线和云通信产品线的基础SDK组件开发工作，致力于为企业客户提供优质稳定可靠的音视频和云通讯基础服务。涉及的产品包括：\n web im sdk - 目前正在研发新版本；\n webrtc sdk - 目前正在对接新的 chrome 协议；\n web player - 目前正在规划新一代的播放器方案。,负责腾讯云 Web 视频播放器的相关开发工作；\n负责腾讯云 WebRTC SDK 的相关开发工作；\n负责腾讯云管理控制台等管理系统的开发工作；\n负责腾讯云 WebIM SDK 的相关开发工作；\n负责腾讯云音视频小程序的相关开发工作。  通过腾讯云技术认证或同等资格认证的优先录取。
CSIG17-LBS产品能力技术评价岗位,"负责互联网LBS产品的核心能力评价，通过评价效果推动LBS能力优化满足用户体验，专注地图路线导航或定位技术等研究，进行数据分析及数据挖掘，跟踪分析国内外竞品与行业标杆，搭建地图核心能力的评估和分析体系，从算法、策略和数据层面（准确性,合理性等）各个纬度制定全方面的评估方案和监控指标,帮助团队提高地图核心服务的能力。",对LBS领域有浓厚兴趣，对用户数据敏感，逻辑思维能力强，具备团队管理经验、有效的沟通能力以及部门间合作经验，拥有3年及以上数据分析或数据挖掘经验（能力优秀者可视情况放宽要求），熟练使用Spark、Cassandra、Hadoop等开源组件者优先；数学或统计学专业优先。
WXG01-微信高级数据分析工程师（广州）,负责微信通讯和社交等业务的数据分析工作；\r\n搭建产品的用户行为数据指标体系，并构建用户行为画像；\r\n负责产品和运营核心策略的分析建模，指导业务科学决策；\r\n设计和分析A/B Testing实验，并将实验分析结果转化为可行的业务策略；\r\n探索产品生命周期、产品健康指数、产品增长机会等；\r\n自驱开展专题数据研究，通过数据驱动产品体验优化和用户增长。,计算机科学、数据科学、机器学习、统计学、应用数学等领域硕士及以上学历；\r\n4年以上数据科学相关岗位的工作经验；\r\n有系统性数据分析方法论的沉淀；\r\n有设计和分析A/B Testing的经验；\r\n有应用机器学习进行业务建模的经验；\r\n熟练使用SQL/Hive语句；\r\n熟练使用Python/R/SAS等数据分析工具；\r\n熟练使用EXCEL/Tableau等数据可视化工具。\r\n\r\n符合以下条件优先：\r\n有Hadoop、Spark等平台的海量数据处理经验；\r\n有国内外互联网公司或其他行业的数据科学或用户增长经验。
25923-devops平台产品经理,参与蓝盾DevOps平台工具链产品研究工作 ，提出解决方案，确定产品功能及用户交互，绘制产品原型图，编写相关需求文档; \n计划、协调和沟通驱动开发团队紧密合作，高效项目执行，达成产品目标; \n持续对行业需求和用户需求进行调研分析，不断优化产品，提升产品质量和用户体验; 时刻关注行业发展，输出竞品分析报告; \n实施工具平台运营推广工作，建立数据分析方法，分析用户行为，了解产品运行状态并提出运营优化方案;\n参与平台上的技术研究和需求开发工作。\n,本科以上学历，计算机软件及相关专业毕业，有两年以上软件开发（java，python等）背景; \n熟悉DevOps体系，熟悉CI/CD相关等研发流程工具平台（如Jenkins/Travis CI/GoCD等）;\n 沟通能力强、逻辑分析能力强、思维缜密，较好的书面表达能力、做事条理性强; \n具有较强的沟通、推动和问题解决能力; \n学习意识/学习能力强，持续研究行业内外研发效能提升工具/方法新领域，喜欢挑战，追求自我持续改进和知识更新; 能承受互联网工作压力和快速交付节奏。
30361-创新产品Web前端工程师,负责社交类创新App的前端和小程序的开发；\n参与跨平台项目的架构设计与实现，承担跨平台技术的重点、难点的攻坚；\n钻研各种前沿技术和创新交互，增强用户体验、开拓前端能力边界。,三年以上前端开发经验，对一到多个专项技术领域有较深入研究;\n精通HTML5、CSS3、JavaScript等技术；\n精通前端性能优化技术；\n掌握至少一门服务器端编程语言，熟悉 HTTP、HTTPS 等常见网络协议，有服务器运维经验者优先；\n爱学习，动手能力强，能不断优化提升产品体验或拓展技术视野。
CSIG17-在线教育高级测试工程师,1、负责CSIG在线教育业务的前后端自动化、专项测试、mock能力建设、monkey等，有效提升测试效率及业务质量。\n2、发现在线教育业务中的痛点，通过测试工具开发、监控平台建设、后台环境治理等能力建设，拓展测试左移、右移、分层测试等测试能力，帮助CSIG在线教育业务提升可测性、整体测试效率及质量。\n3、结合黑盒测试、白盒测试、精准测试、分层测试等测试能力，保障在线教育业务基础质量：平台技术栈覆盖非常广泛，涉及PC、web、h5、小程序、移动端、后台等，其中涉及云直播、云录播、RN、cocos等。\n在线教育覆盖3大业务：腾讯课堂——在线职业教育平台，提升中国年轻人的职场竞争力；企鹅辅导——中小学线上辅导，以最优质的教学内容和教学服务辐射3-4线城市，推动线上教育资源公平化；ABCmouse——独家引入美国知名少儿英语学习产品，结合腾讯产品理念和技术能力，将优质的英语学习体验带给中国的孩子们。,计算机本科及以上相关专业3年以上工作经验，有教育行业测试经验、专项测试或测试开发经验者优先；\n对操作系统、计算机网络和数据库等计算机和软件基础有比较深入的理解和实践；\n熟悉各种常用的网络协议以及其原理；熟练掌握c/c++/java/go等至少一种编程语言或对python/shell/perl等至少一门脚本语言有丰富的实践经历；\n有相关自动化测试、专项测试或测试工具平台建设者优先；\n具备良好的团队合作精神，善于沟通协调，具备较高的问题推动解决能力；\n有不错的工作抗压能力，富有激情，责任心强，做事公正客观。
27092-商业化web前端开发leader（深圳）,负责PCG的应用宝、微视等媒体商业化和内容商业化的跨端样式能力、链路优化、效率工具的整体技术架构规划和方向，其中包括不限于通用可视化配置平台、亿级Nodejs接入层、全域智能触达、A/BTest系统、素材智能化拼接、素材与落地页优选、Hippy与Flutter等跨端能力的整体架构方案的制定和推动落地，要求设计的架构具有高性能和高可靠性，并在前端行业具有前瞻性。,熟知泛前端技能，包括不限于JavaScript（TC39）、http[s]和http2协议、RN \u0026 Weex \u0026 Flutter的跨端兼容解决方案、hybrid App性能调优、Node.js后端研发方案，有主导过上述类似方案并在行业产生影响的经验者优先；\n熟知多线程、TCP/IP协议、后端架构，具有大请求量（5000w+/天甚至亿级)服务高并发、性能分析调优、优秀后端架构设计经验者优先；\n熟悉大规模前端链路调优或通过研发、产品策略推动页面转化率提升经验者优先。\n对前端领域技术有非常深的了解，并能将产品研发经验、行业信息、数据分析、用户研究等能力洞察业务需求，并推演出行业领先的解决方案；
30628-腾讯广告算法工程师（研发中心-深圳/北京）,腾讯社交广告系统后台质量研发，偏重算法策略研究、设计与实现，参加以下一到多项工作：\n用户画像建模 \u0026\u0026 广告精准定向技术\n广告排序算法 \u0026\u0026 策略优化\n广告转化率预估 \u0026\u0026 转化策略优化\n广告素材(文本和图片)语义特征挖掘\n广告用户体验优化\n广告 A/B Test 实验系统\n大规模并行机器学习系统建设,具有扎实的数据结构和算法功底； 熟练使用 C/C++ || Python || Java || Scala\n数据挖掘 || 自然语言处理 || 机器学习\n有海量数据处理经验，熟悉 Hadoop || Storm || Spark\n有广告、搜索引擎、推荐系统相关技术经验者优先\n较强学习能力 \u0026\u0026 逻辑思维能力 \u0026\u0026 具备良好的问题分析与解决能力\n善于沟通，工作积极主动，责任心强，具备良好的团队协作能力
30361-社交产品经理-付费向,基于产品形态对用户需求进行挖掘，制定产品变现玩法能力，促进业务增长； \n挖掘和分析产品数据，研究用户需求及行为特点，提供解决方案，提升用户整体付费率与ARPU值；\n负责产品功能设计和交互设计，撰写详细的产品设计文档和原型设计文档；\n负责方案推进过程中的跨部门协调沟通工作，能协调各资源以确保方案顺利实施。,1～3年社交相关产品经验，对社交产品充满热情；\n负责过直播/聊天室产品中礼物、特权、互动玩法等模块的玩法；\n对数据敏感，有较强的逻辑与分析能力，善于发现与挖掘数据价值； \n有较强的沟通能力、逻辑分析能力，善于发现解决问题；\n 责任心强，能够推进项目进程；
30360-QQ社交功能产品策划经理（深圳）,负责QQ社交功能的策划工作；\n通过洞察QQ年轻用户社交诉求，同时基于数据的挖掘及分析，制定QQ社交模块整体规划；\n独立负责社交及关系链相关功能的产品概念、产品设计、推动实施，提升QQ关系链的活跃度；\n对QQ关系链进行日常维护及数据跟踪，定期分析运营效果，跟踪用户行为。,具备3年以上互联网产品策划的工作经历；\n负责并主导过大型社交类互联网产品，有比较强的数据分析能力； \n具备较强的创新能力，善于分析市场及提炼用户需求，对社交领域有独到的见解和积累；\n具备带人经验，有比较强的自驱力和思辨力，思路清晰逻辑严谨。
25927-游戏测试经理（深圳）,快速上手业务，并组织团队完成产品的质量体系构建和管理工作；\n招聘并构建测试团队，完成团队的建设和发展，实现良好的跨团队合作；\n优化、提高团队的测试效率和输出质量，主动发现问题并优化改善，做好过程和结果的积极反馈和团队的反思提升工作；\n承担团队的游戏运营品质和责任，关注并提升团队业绩；\n承担外网游戏品质责任，关注项目业绩。,本科以上学历，有3年以上软件测试经验，有游戏测试经验者优先，具有快速熟悉业务流程和优化，并建立完善质量体系的能力；\n有过带领团队独立完成项目测试工作，做好工作中的问题挖掘和改善，带领团队提升业务熟悉度和技术能力的提升的经验；\n优秀的执行力和抗压能力，热爱游戏测试，乐于主动反馈和积极思考；\n熟悉至少一门开发或者脚本语言，C++、C、C#、php、python优先；\n熟悉主流操作系统原理（windows、linux、android）、网络协议等，有过前后端性能、安全、兼容等测试经验者优先。
22989-日志研发高级工程师（北京）,负责腾讯云日志服务平台研发； \n大规模日志数据存储、分析与处理。,1. 计算机专业本科及以上学历，3年以上互联网后台开发经验； \n2. 熟练掌握linux环境下c++/c/golang/python中的一种或几种； \n3. 熟练掌握常见的数据结构和算法； \n4. 熟悉网络的基本原理，如TCP/IP协议，HTTP协议等； \n5. 具有较好的团队合作和沟通能力； \n6. 有日志平台开发经验优先； \n7. 有检索系统开发经验（PB级）经验者优先考虑； \n8. 有大数据系统开发、OLAP系统开发经验优先； \n9. 熟悉常见大数据基础组件的使用/原理/调优者优先，如Flume/Kafka/Hadoop/Hbase/Spark/Storm/ELK/ETL/kafka/Hive/ZK等。  通过腾讯云技术认证或同等资格认证的优先录取。
27092-应用宝商业化资源运营合作经理（深圳）,建立及运营部门商业化资源体系，含资源拓展，定价，售卖结算管理。并基于项目/活动需求，进行资源通案策划和个案策划，负责执行落地；\n按照项目节点/项目需求与内部各平台合作，协同产品运营策划合作模式，合作内容，规划合作资源； \n月度对外进行结算对账管理，向内对接BG财管进行收入上报管理；\n了解或知悉内外部合作基本流程，针对各项内外部合作提供流程意见及风险预警，与公司内部各内部平台建立保持良好合作关系。,本科及以上学历，具备2年以上相关工作经验；\n有相关对内对外合作沟通经验，有较强的沟通能力； \n擅长数据处理，了解财务结算相关内容流程； 有整合策划及资源投放运营相关经验，并对效果广告有理解。\n
25924-大数据平台开发工程师（深圳）,负责腾讯游戏大数据应用系统的后端开发工作，处理包括高并发场景or复杂业务逻辑下数据平台的开发设计工作,"本科及以上学历，计算机相关专业，3年及以上相关工作经验,有扎实的计算机理论基础，对数据结构，设计模式有深度的了解；  \r\n开发语言golang、php、java不限，至少精通掌握一种； 对一些开发框架的原理\u0026源码都有一定的了解（如laravel）\r\n具备大容量、高性能复杂系统的设计和架构能力，能够快速根据需求完成系统设计和开发，有良好的团队合作意识，能适应高强度的开发节奏；\r\n良好的学习能力、沟通能力、适应能力，责任心强，能在压力下独立解决问题； 热爱互联网，喜欢挑战者优先； 具备良好的学习能力、分析解决问题能力。"
PCG10-搜索C++后台开发高级工程师,负责浏览器搜索中心业务服务的后台开发工作，通过对业务架构的合理设计与实现支持业务需求的快速实现，支持业务的高速发展；\n系统分析搜索质量，针对性的提出优化策略与方法并实施，对优化效果负责；\n负责搜索基础组件的研发工作，包括分布式检索系统、Query理解模块、分布式存储等方向；\n后台服务的设计、重构、性能优化等工作。,精通C/C++编程，熟悉Linux平台、shell脚本，对数据结构和算法设计有较为深刻的理解；\n熟悉多线程/多进程程序开发，对异步、并发技术有深入理解；\n从事过搜索引擎相关开发工作；\n熟悉TCP/IP HTTP等网络协议，具备海量服务器开发经验者优先；\n本科及以上相关专业学历，5年及以上工作经验；\n具有良好的沟通能力，团队合作能力，自我管理能力，较强的抗压能力。
