招聘岗位,工作职责,工作要求
PCG10-搜索C++后台开发工程师,负责浏览器搜索中心业务服务的后台开发工作，通过对业务架构的合理设计与实现支持业务需求的快速实现，支持业务的高速发展；\n系统分析搜索质量，针对性的提出优化策略与方法并实施，对优化效果负责；,精通C/C++编程，熟悉Linux平台、shell脚本，对数据结构和算法设计有较为深刻的理解；\n熟悉多线程/多进程程序开发，对异步、并发技术有深入理解；\n熟悉TCP/IP HTTP等网络协议，具备海量服务器开发经验者优先；\n本科及以上相关专业学历，2年及以上工作经验；\n具有良好的沟通能力，团队合作能力，自我管理能力，较强的抗压能力。
29316-组织发展经理（深圳）,1.组织有效性相关产品研发及专业服务，包括：参与或主导在组织有效性评估、组织诊断、组织设计等方面相关工具产品的研发及推广；\n2.根据公司发展的需要，针对行业标杆企业做有针对性的研究，为公司未来的组织发展和优化提供有价值的参考或根据需要给出专业的建议\n3.配合组织发展总监结合腾讯集团内部不同的事业群、线和部门，梳理和总结组织设计的最佳实践，为公司内部组织优化提供参考；\n4.参与及协助公司级、事业群级组织有效性诊断和并提供有效的解决方案，配合事业群、线或重点业务部门的发展需要，根据项目的规模和复杂性，作为Co-PM或核心项目成员主导或参与到组织有效性诊断的项目中，为内部客户提供专业的解决方案；\n5.组织设计和优化赋能：协助对项目、管理实践等进行案例总结及做好知识管理、资源库的建立；\n6.设计及开发各种形式的针对HRD、OD、BP等同事的组织评估、设计、优化工具及方法等相关专业知识和技术的赋能。\n7.参与组织绩效、个人绩效体系的优化和相关工具开发。,1.本科及以上学历；5年及以上相关工作经验；\n2.认同公司企业文化，敬业和自我激励；\n3.较好系统性思维、善于分析、提炼总结，及快速学习能力；\n4.良好的口头和书面表达能力、沟通协调和组织能力；\n客户导向强，良好的团队合作意识和能力，同时具备较强的推动及执行落地能力；\n5.有组织有效性评估诊断、组织设计及组织变革、集团管控、绩效体系设计等相关专业知识及项目运作经验者优先；兼具知名人力资源咨询公司工作经验及企业组织发展工作经验者优先；具备海外学习或工作经历者优先。
TEG02-网管系统后台开发工程师（深圳）,负责网络基础架构网管系统后台架构设计与性能优化；\r\n负责海量网络设备分布式采集与控制；\r\n负责网管后台模块的运营和维护，保证系统稳定运行；\r\n参与网管系统的后台需求分析、解决方案设计等工作。,计算机、通信相关专业本科以上学历；\r\n3年以上linux服务器端软件开发经验；\r\n编程基本功扎实，精通C/C++或者Java语言，熟悉Python等脚本语言；\r\n精通TCP/IP协议相关知识及网络编程；\r\n精通Unix/Linux环境和系统编程，熟悉服务器编程模型；\r\n熟悉mysql数据库及相关编程；\r\n善于沟通及主动思考总结，倡导创新与持续优化，思路周密，代码严谨，对技术有强烈兴趣；\r\n有良好的团队合作能力，有强烈的主人翁意识推进事务进展。
TEG02-自研交换机测试高级工程师（深圳）（深圳总部）,负责自研交换机系统，功能，场景测试工作，负责测试工作分解，测试流程制定；\r\n负责主导自研交换机内部测试，交付测试，上线支持等工作；\r\n负责主导自研交换机外部合作测试的工作分解，跟踪，质量验收等工作。,熟悉交换机等网络设备OS，LINUX，L2/L3/QOS/ACL/BGP/OSPF/PORT等功能测试；\r\n熟悉交换机等网络设备自动化框架开发，自动化脚本编写，熟悉自动化运作原理；\r\n熟悉数据中心典型应用场景(例如10G/25G)、拓扑，有数据中心场景商用产品交付经验者优先；\r\n有从事交换机等网络设备商用测试工作5 ~ 10年工作经验者优先。
TEG02-自研交换机测试高级工程师（深圳）（北京）,负责自研交换机系统，功能，场景测试工作，负责测试工作分解，测试流程制定；\r\n负责主导自研交换机内部测试，交付测试，上线支持等工作；\r\n负责主导自研交换机外部合作测试的工作分解，跟踪，质量验收等工作。,熟悉交换机等网络设备OS，LINUX，L2/L3/QOS/ACL/BGP/OSPF/PORT等功能测试；\r\n熟悉交换机等网络设备自动化框架开发，自动化脚本编写，熟悉自动化运作原理；\r\n熟悉数据中心典型应用场景(例如10G/25G)、拓扑，有数据中心场景商用产品交付经验者优先；\r\n有从事交换机等网络设备商用测试工作5 ~ 10年工作经验者优先。
TEG02-光网络控制系统高级测试工程师（北京）,负责开放光网络控制系统的测试，包括制定测试方案和计划，搭建测试环境、编写测试用例、执行系统测试、输出测试报告等；\n负责开放光网络控制系统测试规范、测试流程的建设和优化、培养开放光网络控制系统测试人员；\n负责测试开放光网络控制系统缺陷并协助分析、定位问题，及时合理解决问题，保证产品质量和研发进度；\n负责开放光网络控制系统软件打包、发布及版本控制，现网问题定位解决；\n负责新技术方案验证，评估其可行性、稳定性； \n,大学本科或以上学历，计算机相关专业； \n5年以上网络系统测试工作经验，熟悉ODL平台，熟悉软件测试、系统测试流程及相关工具，需要有较强的质量意识和客户服务意识； \n熟悉传输系统原理，具备传输系统控制器或网管测试经验优先；\n熟悉Linux系统环境，熟练掌握Linux基本工具的使用，至少掌握一种自动化测试脚本语言（如Python，shell，TCL等），能编写自动化测试程序；\n对网络系统测试有浓厚的兴趣，并有持续深钻技术的学习能力；\n有良好的计划、沟通、组织协调能力、语言表达能力；较强的逻辑分析能力和应变能力；良好的团队合作精神； \n
22989-Windows研发工程师(深圳）,负责音视频会议场景的Windows App架构设计与研发工作；\n负责项目的Windows端技术攻坚。,3年以上相关工作经验；\n责任感强，逻辑思维能力、沟通能力强，能够承担工作压力；\n了解MFC/Windows界面实现机制，熟练使用VC，精通C/C++，熟练使用STL；\n理解Windows操作系统的内存管理、文件系统、进程线程调度、网络编程；\n了解Windows系统安全管理和配置，具备基本的驱动开发、调试能力；\n熟悉一种或者几种注入hook技术；\n熟悉Windows调试，熟悉windbg、dump分析，蓝屏分析\n注重模块化，有良好的编程习惯；\n参与开源项目加分；\n有大型音视频项目开发经验者优先。  通过腾讯云技术认证或同等资格认证的优先录取。
21309-企鹅辅导高级产品策划经理（用户增长/付费转化方向）,负责企鹅辅导用户增长和付费转化两个大方向，包括：\n1. 负责企鹅辅导在微信生态以及QQ生态获客，包括但不限于学习工具和承载轻量内容的小程序的产品设计、分享裂变，目标是让更多用户触达到企鹅辅导，了解和信任企鹅辅导提供的内容；\n2. 负责把触达到的用户转化成班课付费用户，包含但不限于运营工具的产品设计，配合运营的售卖激励等。,1. 本科及以上学历，3年以上在线教育或电商相关产品经验；\n2. 了解微信生态，有用户增长或付费转化成功项目经验者更佳；\n3. 责任心强，积极主动，推动能力强，能够敏锐地发现问题，创造性地给出解决方案，并积极推进落地实施；\n4. 有独立带人和带小团队负责相对完整模块业务的能力。
18425-收支管理产品经理,负责境内外多个支付平台各业务的收入、成本管理，包括但不限于以下内容：\n1、参与收入、成本的管理平台建设，保障收入、成本的准确性，应收回款效率，收益结转效率，收入上报集团效率等；\n2、参与各业务项目新的收费点、成本点分析，制定收支接入方案，集中管理；\n3、结合业务、财务诉求，制定各业务多维度分析报表及收支风险监控\n,1、本科以上学历，2年及以上支付或金融行业相关的清结算类产品策划经验\n2、善于快速学习、分析与解决问题，具有较强的逻辑思维与抽象能力\n3、具有一定的数据、合规、风险敏感度，能细致处理问题\n4、具有较强的项目管理能力及执行力，能独立负责产品规划\u0026运营\n5、具备乐观及积极的心态，抗压能力及责任感强，踏实认真，善于沟通与协作\n
29912-微视功能运营高级经理,1、结合微视业务场景与用户交互行为，完成需求的收集、分析与整理，功能联动创意玩法及闭环体验的整体链路及优化迭代；\n2、挖掘微视玩法潜力，整合运营内容、交互场景，建立玩法功能运营策略；\n3、围绕打造爆款玩法、产品运营活动的策划与推进，以及产品营销工具的底层能力建设；\n4、数据整理与分析能力；,1、具有强抗压，严密的逻辑分析能力，良好的沟通协作能力；\n2、有网媒经验、剧本策划，用户玩法经验优先；\n3、良好的创意能力与协作能力；
PCG15-GO/C++/Java后台开发工程师（深圳）,负责NOW直播业务的后台开发及维护；\r\n负责QQ群视频平台业务的开发和维护；\r\n负责互动直播类相关海量后台的架构设计、实现和维护。,"本科及以上学历，计算机相关专业；\n具备Unix/Linux下C/C++/Java/Go其中至少一门语言 1年以上开发经验， 熟悉常用的数据结构、算法设计；\n精通TCP/IP协议，进程间通讯编程，熟悉Unix/Linux下常用架构设计方法；\n熟悉Unix/Linux操作系统原理、常用工具， 熟悉Mysql/Oracle等数据库管理、开发,SQL调优；\n全面的软件知识结构(操作系统、软件工程、设计模式、数据结构、数据库系统、网络安全)；\n具备良好的分析解决问题能力，能独立承担任务和有系统进度把控能力；\n责任心强,良好的对外沟通和团队协作能力；\n有大容量通信系统和大型互联网后台开发经验者优先。"
25928-GCloud游戏云平台高级架构师（深圳/上海）,负责GCloud平台系统架构，制定系统的整体技术规范和业务框架；\n承担业务需求分析并完成技术规划和系统设计工作；\n深入研究竞品，分析行业生态，帮助自身产品不断拓展。,5年以上系统建设，设计，架构经验，有一定技术视野；\n3年以上游戏开发经验，熟悉游戏系统架构，了解行业生态和业务痛点，有大型游戏技术经验者最佳；\n具备较强的团队管理能力和沟通能力，思维活跃，前瞻学习能力强；\n了解软件项目管理、敏捷管理方法论，在中大型项目中有所实践；\n全日制统招，计算机相关专业本科及以上学历。
25928-GCloud游戏云平台高级技术PM（偏技术实施顾问）,作为技术PM对接GCloud平台产品客户群，对接客户需求，跟进产品问题，解决客户痛点；\n深入挖掘客户需求，输出技术解决方案；\n作为需求owner，拉通内外部资源，推动解决方案落地；\n持续优化打磨产品技术方案和提升接入效率；\n规范和优化技术服务流程，提升服务质量和口碑。,2年以上技术开发经验，有游戏行业相关经验及游戏开发背景者最佳；\n1年以上团队管理或大型项目管理工作工作经验；\n熟悉游戏系统架构，具备很强的技术理解能力；\n有较强的沟通能力和服务意识，能从客户角度出发换位思考和推动问题闭环解决；\n具备强大的执行力和学习能力，工作主动性强；\n全日制统招，计算机相关专业本科及以上学历。
25928-高级图形开发工程师（深圳总部）,负责游戏引擎图形相关特性的开发；\n负责渲染流程和算法的优化，以及相关工具的开发；\n负责图形兼容性分析以及疑难问题的分析定位工作。,本科以上学历，精通C/C++，具备扎实的数据结构和算法基础，熟悉常用设计模式；\n具备计算机图形学知识，熟练掌握3D图形渲染技术，熟悉OpenGL以及Shader开发；\n熟练掌握3D游戏引擎架构， 熟悉3D引擎的接口和游戏制作流程；\n3年以上3D引擎（Unreal、Unity等）开发经验，一年以上渲染相关开发和优化经验；\n深刻理解客户端框架和其他核心模块的实现，有主导过核心模块的开发经验者优先；\n熟悉移动端GPU/CPU架构，有移动端渲染开发经验者优先；\n责任心强，善于沟通，对游戏前沿技术应用抱有热情。
25928-高级图形开发工程师（上海）,负责游戏引擎图形相关特性的开发；\n负责渲染流程和算法的优化，以及相关工具的开发；\n负责图形兼容性分析以及疑难问题的分析定位工作。,本科以上学历，精通C/C++，具备扎实的数据结构和算法基础，熟悉常用设计模式；\n具备计算机图形学知识，熟练掌握3D图形渲染技术，熟悉OpenGL以及Shader开发；\n熟练掌握3D游戏引擎架构， 熟悉3D引擎的接口和游戏制作流程；\n3年以上3D引擎（Unreal、Unity等）开发经验，一年以上渲染相关开发和优化经验；\n深刻理解客户端框架和其他核心模块的实现，有主导过核心模块的开发经验者优先；\n熟悉移动端GPU/CPU架构，有移动端渲染开发经验者优先；\n责任心强，善于沟通，对游戏前沿技术应用抱有热情。
25928-Unreal客户端开发工程师 (深圳)  ,负责将AI机器学习技术应用到UE4的游戏中；\n负责将前沿的图形动画技术应用到UE4中；\n负责UE4引擎相关工具开发。,本科以上学历，2年及以上UE4开发经验；\n精通C++，具备扎实的数据结构和算法基础；\n具备1到2款大型3D游戏开发经验优先；\n欢迎喜欢AI、积极进取、学习能力强、善于沟通合作、热爱技术的同学加入。
27560-版本管理（深圳）,跟进协助海外发行商版本计划制定，确定项目组运营需求并推动开发商制作；\n负责引进游戏产品的各阶段版本管理工作，保证版本稳定性； \n跟进游戏版本测试、版本部署、版本发布等版本流程各环节工作； \n负责游戏相关的产品、运营、技术、市场类文档和素材的翻译跟进沟通需求；\n跟进协调研研发团队和海外IP方之间的IP监修、研发计划制定、研发进展同步；\n推动与开发商之间建立有效的合作沟通机制及良好的信任合作关系。,有3年以上项目管理或游戏运营经验；\n英语流利，具备良好的沟通能力\\文字组织能力\\商务谈判能力；\n良好的逻辑思维\\分析总结能力\\数据敏感性，有强烈的责任感和团队合作精神，抗压能力强；\n可接受海外地区出差，育碧游戏爱好者优先。
31504-腾讯云大客户架构咨询专家（北京）,1. 了解游戏相关各类场景及业务诉求\n2. 了解应用、系统、基础设施等各层技术实践及落地\n3. 侧重在公有云环境下运维保障方案，包括并不限于：线上问题管理、全维度全链路的监控管理、线上生产变更管理、故障容灾演练管理、大促重大活动管理以及稳定性文化建设\n4. 基于腾讯云已有的技术支撑保障体系，梳理提炼形成业务领域或特定行业场景的标准运维保障解决方案,1. 5年以上互联网行业相关工作经验，对以下一个或者几个领域有深入的理解：研发、运维、监控、售前/售后技术支持、技术咨询\n2. 对业务运维保障有丰富的实战经验，如复杂业务场景下的流程优化和过程改进、系统的高可用性架构实现、组织的稳定性意识提升等；\n3. 有从0到1运维保障体系的建设和运营经验（流程化、规范化、标准化、工具化、产品化、持续改进）；\n4. 对问题有清晰的分析逻辑和全局思维，能提出具有创造性的解决思路和方案，并有良好的沟通能力和结构化表达能力，以及团队合作意识；\n5. 有较强的抗压能力，能够并行处理多项工作\n6. 有良好的沟通能力、能通过影响他人拿到结果、乐观，快速学习能力强\n\n优先条件：\n1、有团队管理经验；\n2、有ITIL认证，有ITIL体系实践经验，有体系化思维能力；\n3、有PMP认证，有项目管理经验，有系统性解决问题能力；\n3、有6-SIGMA、CMMI认证。   通过腾讯云技术认证或同等资格认证的优先录取。
31504-腾讯云大客户架构咨询专家（上海）,1. 了解游戏相关各类场景及业务诉求\n2. 了解应用、系统、基础设施等各层技术实践及落地\n3. 侧重在公有云环境下运维保障方案，包括并不限于：线上问题管理、全维度全链路的监控管理、线上生产变更管理、故障容灾演练管理、大促重大活动管理以及稳定性文化建设\n4. 基于腾讯云已有的技术支撑保障体系，梳理提炼形成业务领域或特定行业场景的标准运维保障解决方案,1. 5年以上互联网行业相关工作经验，对以下一个或者几个领域有深入的理解：研发、运维、监控、售前/售后技术支持、技术咨询\n2. 对业务运维保障有丰富的实战经验，如复杂业务场景下的流程优化和过程改进、系统的高可用性架构实现、组织的稳定性意识提升等；\n3. 有从0到1运维保障体系的建设和运营经验（流程化、规范化、标准化、工具化、产品化、持续改进）；\n4. 对问题有清晰的分析逻辑和全局思维，能提出具有创造性的解决思路和方案，并有良好的沟通能力和结构化表达能力，以及团队合作意识；\n5. 有较强的抗压能力，能够并行处理多项工作\n6. 有良好的沟通能力、能通过影响他人拿到结果、乐观，快速学习能力强\n\n优先条件：\n1、有团队管理经验；\n2、有ITIL认证，有ITIL体系实践经验，有体系化思维能力；\n3、有PMP认证，有项目管理经验，有系统性解决问题能力；\n3、有6-SIGMA、CMMI认证。   通过腾讯云技术认证或同等资格认证的优先录取。
30361-社交产品经理-创新向,负责创新产品功能的产品策划，从产品概念提出、设计到推动实施； \n负责制定具体产品执行计划并保证其得到高效高质的项目执行； \n在所负责的项目中起到关键角色，和团队高效合作，并推动跨部门合作； \n对所负责的模块进行数据跟踪，定期分析效果，跟踪用户行为。,1至3年社交相关产品经验，对社交产品充满热情；\n热爱互联网产品，喜欢研究新产品新方向，创新力强；\n有较强的沟通能力、逻辑分析能力，善于发现解决问题；\n责任心强，能够推进项目进程；\n社交产品、泛娱乐产品重度用户优先。
CSIG16-大数据AI高级工程师(北京),1. 利用海量腾讯系的定位数据（500亿）及形成的用户轨迹数据，进行海量数据模型设计、数据ETL开发，实现智能化处理和自动化入库；\r\n2. 应用机器学习技术，建立道路数据画像，构建实时的基础数据的挖掘模型，提升位置服务能力\r\n3. 研发智能交通出行领域中的关键机器学习算法，以及模型算法的产品化,机器学习／计算机／数学相关方向硕士以上学历或 3 年以上工作经验，有较强的学习能力及创新能力;\r\n熟悉C/C++语言、Python、Java任意一种语言，较强的算法和数据结构功底;\r\n对机器学习基础理论及常用算法有深刻的理解，具备出色的工程实践能力；\r\n在机器学习或者机器学习应用（包括但不限于搜索/推荐／自然语言处理／计算广告／图像处理等方向）方向有2年以上相关项目经验；\r\n良好的沟通能力及团队协作能力，较强的进取心和事业心。
S2-区块链应用开发工程师（深圳）,负责基于区块链技术的产品设计与研发工作；\n负责腾讯内部财务IT应用系统的设计与研发工作。,计算机软件相关专业本科以上学历；\n3年以上linux服务器端C/C++开发经验，编程基本功扎实，熟悉软件工程和测试方法；\n熟悉区块链平台技术和特点（如：比特币、以太坊、Fabric等），理解智能合约的概念；\n有服务器端大容量、高性能编程框架应用实战经验，熟悉mysql数据库和KV数据库编程；\n精通TCP/IP、HTTPS协议相关知识及网络编程；\n思路清晰、周密，能主动思考总结，乐于与人沟通；\n有良好的团队合作及抗压能力，有主人翁意识推进事务进展。
S2-高级web前端开发工程师,负责腾讯内部财务系统的web前端开发工作，包括PC、移动端、小程序的前端页面开发及性能优化；负责前端架构建设，公共组件的设计与开发\n\n,本科及以上学历，计算机相关专业； \n5年以上Web前端开发经验； 能够熟练运用HTML、CSS、JavaScript构建高性能的web应用程序； \n能够熟练运用至少一款主流的JS框架（如vue、react等），具有良好的代码风格、接口设计与程序架构； \n有Node.js和小程序开发经验者优先；有交互设计思维更优； 思路清晰，具备良好的沟通能力和团队协作精神。
33370-车联网高级服务管理工程师（深圳） ,负责业务各项管理流程的建设，负责组织相关流程的推行； \n负责对服务工单平台的质量进行度量，分析，形成可执行的流程跟进落地； \n负责客户方案实以及运营过程中发现、收集流程与质量问题并通过事件、变更、问题管理，推动、跟踪问题的解决； \n负责团队内流程服务的文档管理工作，重点包括服务目录建设、服务级别协议制定、服务汇报与客户满意度运营；\n对已颁布流程进行监控以保证其执行，反馈执行情况，并对此过程中发现的问题给出解决建议；  \n整理输出流程缺陷并跟进落实流程的执行，帮助服务团队提升服务质量和研发运营效能。,"本科、硕士（含）以上，5年以上工作经验；\n必须具备ITIL/PMP/Agile/ITSM等流程/项目管理体系知识与相关认证一个或多个;\n对质量保障体、IT服务管理、软件工程等有深入了解；\n对存储/数据分析/系统架构有一定的技术积累,有linux/windows系统运维管理经验;\n具备组织能力，和较强的推动力，能够根据情况需要制定和调整客户运营流程以及过程质量实施策略落地与改进； \n具备较强的数据分析以及流程识别能力，能独立给出运营流程交付物和质量问题的解决方案。"
32032-游戏系统策划（上海）,主导设计并跟进模拟经营类游戏的玩法、操作，商业化模块以及相关系统的设计和制作；\n撰写对应的设计文档，参与相关界面的交互设计；\n在开发过程中实时跟进并调优，确保按时且保质保量的制作出对应的系统。,至少5年以上的模拟经营类游戏策划工作经历以及1款完整的上线项目经验；\n负责过主要系统模块的设计和商业化模块的设计；\n具备良好的沟通协作能力，熟悉如何推动设计落地；\n热爱游戏，有良好的游戏文化背景；\n日语优秀者优先考虑。
27092-商业化Android高级开发工程师（深圳）,1.负责应用宝商业化开发，包括游戏/广告的整体商业化系统开发。\n2.负责短视频产品商业化，具体为实现广告全链路及商业化展示，包括动态化方案的开发。\n3.负责信息流及视频广告在Android下的应用开发\n4.负责游戏裂变及云游戏等创新方向的应用开发,三年以上Android成熟互联网行业项目开发经验，主导过核心功能模块的设计实现\n熟悉Android框架及各种特性，熟练运用相关开发工具\n熟悉常用的设计模式，精通移动客户端程序设计方法以及安全的应用层协议设计，有良好的架构能力\n具备分析解决问题能力，能独立承担任务和有系统进度把控能力\n工作积极主动，有强烈的责任感和严谨的工作作风，对技术有热情，对移动产品有浓厚兴趣\n\n有SDK类项目架构经验优先\n有RN/Weex/Flutter等大前端实践经验优先\n有Tensorflow OpenCV等开发经验优先\n同时具备iOS开发能力优先
