招聘岗位,工作职责,工作要求
WXG01-113 微信后台开发工程师（广州）,负责微信基础产品的平台和运营能力建设；\n参与微信基础产品的数据平台设计和搭建；\n参与微信产品核心数据的维护和监控；\n参与微信基础数据服务框架的开发和维护。\n,"2年以上Unix、Linux操作系统的C、C++项目的开发经验；\n熟悉网络编程，精通TCP/IP协议及编程，熟悉互联网应用协议；\n具有高并发、高性能服务系统设计经验及能力，能独立承担任务和有系统进度把控能力；\n熟悉python、bash 等脚本语言；\n熟练掌握SQL或其他数据库语言；\n良好的代码编写习惯, 有进取心, 求知欲强烈, 具备良好的分析解决问题能力；\n有游戏、海量服务、高性能、分布式系统设计、开发经验者优先。"
27020-云计算开发工程师（深圳）,"在腾讯云上部署以及扩展 JupyterHub, JupyterLab。\n基于 JupyterLab 开发可视化插件。\n开发和部署云 HPC 计算任务和数据库服务的中间件。\n研发化学模拟计算任务的管理工具。","精通 Linux 操作系统；\n精通前端，中间件相关的编程语言，开发工具，测试工具；\n熟悉虚拟化技术和容器编排的知识；\n熟悉各平台和工具 (Linux, Python, Node 等) 的包管理工具；\n有学习热情和团队协作精神。"
PCG10-浏览器搜索后台工程师,大规模分布式内容平台的设计和开发；\n参与项目的架构设计、评审、技术攻坚及优化\n建立搜索内容体系，完成产品需求并负责提升服务质量；\n,1.两年以上工作经验，计算机基础扎实，熟练掌握C++编程，代码简洁清晰；\n2.熟悉linux开发，网络编程，有高并发服务开发经验者优先；\n3.熟悉mysql/nosql的开发，有了解常用大数据基础组件的使用/原理者优先，如kafka/hadoop/hive/spark/ETL等；\n4.有较好的自主发现、分析、解决问题的能力，有数据驱动意识，推动业务发展；\n5.对技术有热情，有较好的学习能力和责任心；\n6.较好的沟通能力，团队协作意识，积极主动；
S2-Java应用开发工程师（深圳）,负责公司财务应用系统的设计与开发工作\r\n参与应用系统的需求分析、方案设计、开发与实施\r\n负责跟进应用系统上线后的运营监控与优化,掌握良好的计算机理论基础知识 五年以上工作经验，有三年以上大型公司（或系统）开发经验\r\n熟悉linux开发环境，熟悉多线程、网络编程;熟悉Oracle/MySQL/SQL语言，熟悉常用的数据结构与算法\r\n熟练掌握Java后台开发技巧，理解和掌握常用开发组件的原理与技巧，如：MyBatis、各类RPC框架、Zookeeper\r\n有大型分布式、服务化系统架构经验者优先\r\n良好的表达沟通能力，团队合作能力，主动性强，执行能力强，具备良好的问题定位分析能力
19838-影视艺人合作经理,统筹影业项目选角工作，为影视项目提供专业的演员选择标准、搭配建议及阵容评估；\n梳理科学的选角统筹体系，构建完善的选角工作流程机制，推动影业选角工作专业化、规范化、标准化；\n通过驻组、探班等形式，跟进影业项目的拍摄情况及艺人在组表现，掌控影业项目进展与艺人专业性及合作态度；\n长期维护艺人经纪公司资源拓展及艺人关系的，梳理互娱市场侧及影业的艺人合作资源及需求，在此基础上探寻与艺人合作机会，沉淀具有互娱属性的核心艺人。\n为战略合作艺人及新人制定专业的培养计划，因人制宜，根据艺人各自的优势及潜力点，为其匹配不同的影视项目及娱乐营销合作机会，稳步推动艺人成长，并反哺影业及互娱业务达成共赢。,大学本科及以上学历，3-5年选角及艺人合作经验，有艺人BD合作相关经验、影视行业媒拓经验、项目制作经验优先考虑；\n熟悉表演，对表演有认知，了解演技专业评判体系，具有丰富的影视圈资源及艺人资源，擅长拓展合作关系，熟悉艺人价格及市场行情；\n拥有良好的沟通、协调、统筹、社交能力，具备良好的行业敏感度和综合管理能力，抗压能力强。
19839-腾讯影业战略分析经理,研究与分析：对全球和中国影视、动漫、泛娱乐行业进行持续的监测与分析，关注行业前沿动态，探索新的商业模式和市场机会；研究影视、动漫行业全价值链环节，从对标视角开展行业研究。基于当前业务重点，主动提报研究选题，并自主或结伴推进专题研究，产出有洞察、可落地的结论，为管理层的策略制定及投资方向提供决策支持；\n立项与落地：作为嵌入核心业务的策略职能，研究是基础与起点。基于前瞻的预判、扎实的研究，推动相关业务和部门的业务发展与管理提升。\n,具备2-4年市场分析和战略规划工作经验（管理咨询、证券分析、市场研究、决策支持等角色），有个人认知与研究框架，中英文流利；\n对影视、动漫、泛娱乐行业有基本的了解，愿意将其作为长期的职业领域，对影视、动漫以及更广泛的泛娱乐、互联网有独特理解者加分；\n兼具单兵作战和团队协作的能力，在过往的职业经历中专业性和协作力得到普遍认可；\n具备在复杂业务环境下，自我驱动、结果导向、抗压求胜的特性。\n
33370-腾讯自动驾驶系统软件工程师（北京）,• 参与自动驾驶系统中间件项目的设计开发，构建高性能可扩展中间件。\n• 参与自主车系统软件定制化修改和实时性优化。\n• 负责自主驾驶汽车各功能模块接口设计与实现。 \n• 与各功能模块团队合作，自主驾驶系统完成集成并优化。,• 具有丰富的C/C++编程经验和良好的代码编写规范，精通GPU/NEON加速者优先\n• 具有丰富的Linux/Unix/RTOS系统编程和ROS开发经验，精通多线程/进程编程。\n• 熟悉分布式系统的设计和应用，有大型中间件系统开发经验。\n• 熟悉实时系统相关的数据分发、任务调度、性能评测方法。有DDS、SOME/IP等协议经验者尤佳。\n• 具有复杂系统软件架构设计和测试经验。 \n• 具备较好的沟通表达能力和团队合作精神。 \n• 具有自主驾驶车辆软件架构设计经验优先。
32257-媒介传播经理（深圳）,结合集团发展业绩财报分析拟定选题策划\n海外媒体/财经媒体关系维护及资源拓展\n重点媒体战略合/KOL及专家分析师拓展\n日常新闻传播媒介沟通及媒体活动执行\n,5年以上媒体或公关行业工作经历，有一定的媒体资源优先\n良好的英文听说读写能力和优秀的中/英文稿撰写能力\n擅长沟通及内容策划，有新闻或财经专业背景优先\n了解知识版权及音乐娱乐行业，学习及抗压能力强\n
21229-沙盒/生存类产品运营策划（上海）,负责沙盒类生存类产品的评测、分析；\r\n负责沙盒类生存类产品的分析和研究，并对本地化和商业化输出修改建议；\r\n分析产品数据和用户研究，针对数据及用研反馈调整产品内容计划；\r\n负责游戏运营工作，对游戏产品和用户体验负责。,对产品和用户理解力强，有自己的判断和见解；\r\n热爱游戏，有大量产品经验；\r\n3年以上游戏策划或评测相关经验；\r\n英文流利者优先。
